排名,书名,作者,类型,进度,字数,积分,标签,时间,简介
158,三分野,耳东兔子,原创-言情-近代现代-爱情,完结,427589,7607145984,"['励志', '轻松']",2018-12-11,1、向园如果知道后来她跟徐燕时会再重逢，并且还不可救药地爱上他。那么当初一定牢牢守住自己的节操，绝对不会当着他的面——一个接一个的换男朋友。2、后来有人问：“徐燕时，你这样做值不值？”他那时姿态慵懒地靠坐在公园的长椅上，一只胳膊挂在椅背上，另只手边拎了瓶啤酒，眼底情绪未名，却令人无限惆怅，他慢慢仰头灌了口，眼神却紧紧盯着不远处灯火通明的大楼：“小时候大人们常说，这个世界是美好，可我发现这个世界并不如我想象中那么美好时，我没想过要怎么去匡正。我只想送她一个，我认为的理想世界。”闷骚毒舌高冷慵懒X甜美可爱人见人爱更新时间：看文案【一个很严肃的提醒：不要去任何包括但不限于扣扣、网易云等音乐、抖音、小红书等等的书中相关引用歌曲的评论区以及跟我文不相关的评论区去提我的文，不要打扰别人，谢谢大家！】考据党勿入。谢绝任何形式扒榜微博：@耳东兔子luckygirl
159,天宝伏妖录,非天夜翔,原创-纯爱-古色古香-传奇,完结,1053744,7590821376,['轻松'],2017-04-01,凤凰引领千万飞鸟，从天际尽头飞来，身后是火海般的滚滚层云，掠过长安。金翅大鹏高居兴庆宫殿顶，瞳中映着繁华神州的苍生，寂静中万般兴灭，潮退潮生。李景珑拖着伤痕累累的身躯，手中释放出璀璨的光芒，不断靠近鸿俊。“生者……为过客……”他低沉的声音响彻世间，刹那铺天盖地的黑雾在那光明前退去。“死者为……归人。”那光芒是照耀天地的炽日，是夜空中闪烁的星辰，是一盏破开黑暗，永世不熄的心灯。“天地一……逆旅，同悲万古……尘。”李景珑闭上双眼，将一手按在了鸿俊的额头上。白光刷然扩散，覆盖了尸山血海的战场。在那盏灯的光影里，平康里的灯红酒绿、驱魔司夏日阳光下的梧桐、茫茫塞外的漫天风沙与飞雪、阿泰如清泉般的歌声、莫日根与陆许摘下的清晨树叶、裘永思飞扬的笔锋，尽化作李白杯中不朽的诗篇——五陵年少金市东，银鞍白马度春风。落花踏尽游何处，笑入胡姬酒肆中。走到哪里就倒霉到哪里的攻X会吸走身边人运气的受本文又名《谁还不是王子了咋地？》4月21入V**************************************我是一条分隔线**************************************我大晋江的中秋赛诗会来啦，欢迎大家踊跃参加~
160,新世纪，新冥界,林知落,原创-纯爱-近代现代-奇幻,完结,701610,7577239040,"['灵异神怪', '爽文', '经营', '时代新风', '轻松']",2019-01-11,本文纯属娱乐，没有原型，请勿代入，相信科学么么哒！.喻争渡入职了一家号称做“人生管理业务”的小型创业公司……做程序员。入职第一天，他接到陌生电话：“你好，我收到你们公司发的短信，通知我明天去投胎……”喻争渡：“……？？”美貌小老板商阙：“欢迎入职人间地府办事处，一千年前，人间称我为，罗酆（feng）山鬼王。”喻争渡：“……？？”从此，他为地府的发展操碎了心。.后来，罗丰人生管理规划有限公司年会主持人激情发言：“我们的目标是——”众鬼：“全面实现地府工作现代化！”喻争渡：“赚钱——上市——暴富——”商阙：“听男朋友的。”再后来，无意间翻墙下载到地府APP的人类，再也无法忘记被“自助投胎”功能支配的恐惧。.预警：1.程序员受。2.私设如山，大山！3.防盗比例60%，24小时。.作者微博：“一个酷炫的ID”，欢迎关注。完结文：《全娱乐圈颤抖》《和宿敌结婚当天一起重生了》.新文《工业修真[直播]》，请多多支持鸭！文案：一场小意外，小主播诸长泱穿越到修真界。坏消息：他在这里没钱没宗没修为，十分穷困潦倒。好消息：直播系统还在。吃饭要紧，只好干回老本行，给大家直播一下修真界的风土人情。坏消息：本地盛产晋江热门职业，虐恋魔君、纯情仙师、风流多情合欢宗……遍地是大佬，个个很凶残。好消息：网友爱看。一开始，网友对他的修真界之旅是嗤之以鼻的，这是一个用实力说话的地方，就诸长泱这基础条件能刚得过谁啊，去趟远门都费劲。网友：这能有什么看头。然后，诸长泱掏出了一辆自行车。网友：？？接着，诸长泱掏出一个电饭锅。修真界：？？？？？？一段时间后，网友：大哥我服了，你赶紧开播，我倒要看看你还能造出点啥。别人修真：从筑基到飞升。诸长泱修真：从小家电到重工业。诸长泱：我们的目标让修真界的普通人也能过上方便快捷的生活。
161,嫁给铁哥们,衣落成火,原创-纯爱-架空历史-爱情,连载,3602020,7558273536,"['天作之合', '穿书', '抽奖抽卡', '盲盒']",2023-06-16,琨云城的天之骄子邬少乾被废了！不仅一日之间从云端跌落到泥泞，还神魂将散，已然濒死。邬家嫌他废了，又要面子，遂威逼钟家嫁女，并带嫁妆——能救命的固魂果。钟家连夜商议，三位适龄骄女皆不愿意，而若不是真心情愿，固魂果就没有用处，邬少乾一殁，钟家必受迁怒。钟家四房嫡子钟采挺身而出：“我愿去。”嫡系都有固魂果，一时间皆大欢喜。·钟采穿越十八年以后，自家“暗度陈仓”的铁哥们突然要挂了，他看一眼慕强的堂妹们，生怕她们嫁过去后一个念头不甘心，他哥们就人没了。所以他想了个好主意。反正邬家娶的是果子，谁嫁不是嫁，放着他来！·邬少乾成了废物，瞬间就被父母亲人放弃，连婚事都不能自主。他无意连累他人，已决定几年后风头过了，就将钟家女放归。然而——洞房花烛那一夜，他最好的朋友迫不及待地掀开盖头，一脸灿烂地把他摁倒下去。钟采：“老邬！赶紧的，我来救你~~”邬少乾：“……”不至于不至于！-----小设定与注意事项如下-----秘藏修者境界：天引境（一阶）、辟宫境（二阶）、开光境（三阶）、悬照境（四阶）、融合境（五阶）、筑宫境（六阶）、化灵境（七阶）、涅槃境（八阶）、通天境（九阶）关于设定上的疑惑，可以在第1章的加精评论里找。其他方面的问题，可以看文案上的注意事项。注意事项里也没有的，可以去第1章的那个加精设定评论里问，我定期会去查看解答的。【注意事项-随着读者反馈持续增加-叠很多甲】①从头到尾一对一，先婚后爱，无虐。他俩都会给对方最好的，即使还没爱上时也是。恋爱后他俩对彼此非常腻歪非常恋爱脑。不过也因为他俩太熟了，恋爱前还有比较新鲜的探索过程，恋爱后找到了新的相处方式，基本就老夫老夫了，环境影响也让我弄不了花活……遗憾。读者评价分歧很大，正面评价大概有[好甜][稳稳的很安心]，负面评价大概有[油腻][感情水套路重复]。②半升级流，玄幻背景，世界风气很冷酷，弱肉强食的类型，请时刻谨记实力至上，其他都是虚妄，不要代入普通古代背景。强调：弱（实力弱资质差）肉，强（实力强资质高）食。③穿书文，原书主角邬东啸。原书属于男频后宫小说，会描写部分相关情节，请不要代入现实。④会包含一些乱七八糟的元素，设定很详细，都是我自己想看的东西，属于自割腿肉了。这篇文的读者吧，喜好五花八门的，众口难调，我就认真写了内容提要。大家按需购买，不喜欢的直接跳章吧。正文不足的，会有番外补充。大家放心，我从没烂尾过。⑤前后风格没有变化，免费章我怎么写，开v后也还那么写（真觉得我写法变了可以具体给我举例，我再看看）。根据读者反馈，追平以后养肥观看体验更佳。免费章看完也体验不佳的话，后面也很难喜欢了，就及时止损吧。⑥大家和平讨论别吵架，咱们都是讲道理的人哈么么哒。
162,不二之臣,不止是颗菜,原创-言情-近代现代-爱情,完结,335664,7541096448,"['都市', '情有独钟', '婚恋', '甜文', '轻松']",2019-04-16,【出版到期，平行番外在微博：不止是颗菜】季明舒和岑森结婚的第一年，岑森远赴澳洲开拓海外市场。第三年，岑森回国。季明舒朝他脸上扔了一张离婚协议书，妄图结束这段丧偶式婚姻。岑森闭眼按住纸张，安静三秒后又将其压至桌面，神色自若道：“明舒，我尊重你的意见，不过你可能需要我帮你回顾一下婚前协议，离婚以后，你恐怕没办法继续收集稀有皮birkin，坐私人飞机去米兰看秀，眼都不眨拍下十五克拉斯里兰卡帕德玛蓝宝钻戒……”“等等！”季明舒忽然清醒，“我觉得……还能再忍一下。”骄纵大小姐x腹黑大boss何其有幸，我这一生，能做你的不二之臣。
163,狂恋你,甜醋鱼,原创-言情-近代现代-爱情,完结,470962,7502336000,"['都市', '天之骄子', '轻松']",2020-03-25,【正文完结】下一本写《诱吻玫瑰》，蹲个作者收藏~@晋江甜醋鱼【双向救赎/病娇少年歌手x佛系神颜刺青师】【1】平川大学有两个传奇。年少赢得金曲奖的林清野，顽劣放纵，网络上批评不绝，却粉丝如潮，集万千宠爱于一身。被誉为“平川之光”的校花许知喃，人间初恋，温暖善良，常见她抱着本佛经念念有词。两人天差地别，互不相识，直到某天一次意外，关系天翻地覆——后来，林清野坐在台阶上，指尖捻着一支烟，笑得痞气又散漫：“阿喃，你跟了我吧。”大家背后感慨，许知喃真是空长了一副神颜，最终却也被林清野那样的混蛋玩弄股掌。【2】林清野复出演唱会上，他闪闪发光，底下是撕心裂肺喊着他名字的粉丝。最后的ending pose，他背对粉丝，汗流浃背，印出后背那副大片的纹身，是一个少女。这张照片一出便席卷网络，大家纷纷猜测被林清野刻在后背上的女人到底是谁。直到某次节目组去林清野家突击检查，林清野上身赤着打开门。转身时直播间粉丝终于清晰看到他背后的纹身图案以及旁边的两个字——“阿喃”随即，卧室门打开，容貌出众明媚的女人穿着男士衬衫，睡眼惺忪走出来：“林清野，你又把我衣服扔哪去了？”直播画面中，女人的脸和林清野背后的纹身正好吻合。*二十岁的林清野鲜衣怒马，不与平凡，风月无边。可阿喃朝别人笑一下，他就不屑一顾却嫉妒发狂。我想拉你入地狱，却又奉你如神明。*1.SC，双初恋2.男主非爱豆，是歌手，恋爱不涉及偶像失格3.文中关于刺青的相关资料与科普查自网络==接档文《诱吻玫瑰》==【婚恋\甜文】斯文败类腹黑总裁x美艳大小姐姜滟最后悔的就是年少轻狂时曾不要命地疯狂撩拨宋行舟。少女美艳又明媚，紧挨着冰山似的宋行舟娇滴滴说情话。可惜冰山依旧是冰山，于是姜滟厌了，拍拍屁股潇洒走人。这本来只是一个妖精勾引书生失败的故事，但姜滟没想到长大后还会遇到那油盐不进的宋行舟——母亲指着门口那身形笔挺、西装得体的男人：“滟滟，认识一下，宋行舟，你的未婚夫。”男人看着她淡淡地笑，模样儒雅：“初次见面，你好。”姜滟：？两人的婚礼声势浩大，从前的同学都来了。众人都以为这是妖精缠了书生多年，终于将书生拐离正途。婚宴当晚，从前的男同学攀着宋行舟的肩调侃，怎么又和姜滟扯上关系了。宋行舟弹了弹烟灰，似笑非笑道：“看她实在太欠收拾。”*没人知道，年少时姜滟离开的那个冬夜，宋行舟一件单衣在雨中等她到破晓。宋行舟对姜滟不是一见钟情，也不是日久生情，而是惊鸿一瞥。
164,子夜鸮,颜凉雨,原创-纯爱-近代现代-爱情,完结,897160,7491028480,"['幻想空间', '欢喜冤家', '无限流', '爽文', '轻松']",2018-06-15,子夜零点，两声猫头鹰叫，徐望被卷入了名为“鸮”的世界，生活就此分成“白天现实”和“夜里闯关”两部分。————————无限流，小伙伴们组团闯关~系列文《子夜十》是后十关的故事~~(づ￣ 3￣)づ
165,天雷能有什么坏心思呢,春风遥,原创-纯爱-架空历史-剧情,完结,765958,7485726720,"['强强', '打脸', '爽文', '升级流', '轻松']",2021-11-10,【全文完】杜圣兰，修真界最顶尖的天才，三岁凝剑气，五岁唤起武道之碑的共鸣，十岁独自前往禁地。然而世人对他的评价只有一句——可惜。可惜杜家已有麒麟子，可惜杜家欲灭杜圣兰。杜圣兰的父亲：“任你是旷世奇才，也不能与家族抗衡。”志趣相投的朋友：“非我故意背叛，帮了你，等于同时得罪两大修真世家。”曾经的师尊：“欲灭杜家，除非你化身天道，然大道至公，你若成天道，便不能因一己私欲报复。”九川大陆，三百年无人飞升，传言天道有缺，修士到渡劫期已是极致。是以四大家族巍然不倒，呼风唤雨。杜圣兰：……有趣。四大家族联手追杀杜圣兰，欲逼其飞升，补全天道。那一日，在众目睽睽下，杜圣兰终于渡劫，化身成了……天雷。“天道不能帮我除恶，我便化身九天雷劫！我开心时，劈一个；我忧愁时，劈两个；我伤心时，劈三个……”“十日为一旬，前五日劈杜家，后四日人渣中随机挑选幸运儿，十号我放假。”“嫁娶日不劈，服丧日不劈，年末岁尾不劈。”……睚眦必报沙雕受X阴险毒辣痴情攻注：后期受会重新修炼出人身，但本体依旧是雷劫。本文将于11月25日入V，感谢支持~《银河第一可爱》求预收苏茶是一只花妖，服役期满，系统同意给他一个团宠的新人生。“我为你精心挑选了一个地方，生活在那里的种族以残暴著称，但幼崽出生率极低，每一个幼崽都是他们不惜生命呵护的珍宝。”“你的新身份是一只珍稀的幼崽。”传送过程出错，苏茶被送到了另一颗星球：伽蓝星。浑然不知情的苏茶自以为抱着团宠剧本，拦住正好过路带队回来的铁血将军。苏茶微微一笑，疯狂暗示：幼崽来了，快把我往死里宠！###伽蓝星人天生没嗅觉，冷血好战，最讨厌弱小的东西。直到那一日，他们闻见了花香。“！！！”###雾星和伽蓝星要做文化交流，震惊银河系。然而不到一天，文化交流变成了两军对垒。据说起因是争夺一只幼崽。###系统修好程序，连忙来找昔日的伙伴，却见天空中漂浮着无数战舰，战争一触即发。系统大惊：“什么情况？”苏茶虚弱一笑：“别问，问就是星球大战。”“……”文案已于2021.7.26日截图，盗梗必追责！
166,天才女友,素光同,原创-言情-近代现代-爱情,完结,933727,7448605696,"['天作之合', '青梅竹马', '励志', '甜文', '轻松']",2020-04-07,【同名实体书第一册、第二册已上市】【盗文网有大量错误，全文精修版只在晋江，对盗文错误概不负责】林知夏九岁时，显然是个天才。江逾白九岁时，不幸与林知夏成为同桌。他的日常生活包括不愿起床、恐惧上学、粉碎自尊、重塑自我……等等。江逾白长大以后，林知夏忽然对他说：“江逾白，我喜欢你，哲学和生物学意义上的喜欢。”那个夜晚，他脸颊微热，还听见自己加速的心跳声。CP（强强）： 江逾白：放弃科研·继承家业·看起来像个男主角林知夏：天之骄子·直球大师·每天都很开心的女主角——————————1.全文无穿越无重生无系统，就是最土的那种现言。2.女配暗恋女主（后来女配找到了志同道合的女朋友）3.作者仅对计算机的极少数分支领域较为了解，其他学科知识来源于咨询与资料查阅，还望海涵，感谢阅读4.文案发布于2019年10月，当时配角栏已固定————————**下本已开《天宇开霁》（公主登基做女皇），戳作者专栏可以找到**
167,古董下山,缘何故,原创-纯爱-近代现代-爱情,完结,693047,7445066752,"['都市', '平步青云', '打脸', '玄学', '轻松']",2018-09-18, 伟大光明先进的二十一世纪一个在山里呆了不知道多少年的老古董为了重振宗门，借了具肉身，揣着银两和大洋下山进城了然后他发现，重振宗门这件事，场地、盖房、装修、人工、社保……桩桩件件，当代创业真的很艰难钱也不好挣，工也不好打，肚子饿的时候，只能靠吃孤魂野鬼才能维持得了生活这样子————————卫家爹不疼娘不爱的大儿子在失踪数月后被送了回来突然性情大变，喜怒不定，武力值超标，看谁不爽就打谁，日天日地孙子也不好好当了，戏也不好好拍了，成天风里雨里搞封建迷信这怎么了得？————————一个大师的致富经，主角日天日地万人迷，锅碗瓢盆孤魂野鬼山珍海味什么都吃，非常奢靡不要脸本故事纯属虚构，专业知识全是扯淡，神经病风水文，主受圆子的专栏，希望大家能够进去给个收藏:-D：微薄——@晋江缘何故   #http://_1{color:#DC143C;font-weight:bold;border-style:double;}
168,如何为始皇崽耕出万里江山,木兰竹,原创-言情-古色古香-剧情,完结,1697234,7427647488,"['种田文', '系统', '爽文', '轻松', '秦穿']",2022-12-09,农学教授朱襄穿越成战国乱世的赵国平民，好不容易生活有了些起色。携家里所有细软跟豪商跑了的长姐将外甥丢给他，说她和另一个豪商好上了，不方便带孩子。气愤的朱襄刚想把孩子送与他人养，却得知这个孩子名为政，其父为秦国王孙异人。朱襄茫然，我外甥是嬴政？？但我姐不叫赵姬，叫春花啊！为了不让始皇帝从历史中消失，朱襄决定咬紧牙关，勒紧裤腰带养育始皇崽。“叮”的一声金手指“耕种系统”上线，与历史名人的好感度可兑换良种。朱襄泪流满面地亲了亲始皇崽的额头：“不愧是始皇崽！真给力！看舅父为你种出万里江山！”很久以后，秦始皇俯首案牍间小憩，仍能梦见童年那一幕。舅父牵着他的小手，走过漫长的田埂，指着接天的金黄色穗田。“政啊，舅父有一个梦想，将良种种遍日月所照所有土地，让黔首都能吃饱肚子。”“舅父，政把日月所照所有土地都打下来，给舅父种田，好不好？”“啊？哈哈哈哈哈，好啊。”舅父让他坐在肩上，哈哈大笑，“政的国土扩张到哪，舅舅的田就种到哪。”大手握住小手。“一言为定。”——注意——1、本文文风通俗，多现代词汇，人物之间称呼和对话不依循先秦古例（比如用“你我”不用“汝吾”），温馨养崽团宠轻松种田日常群像文。偏日常和群像，节奏慢。主角开局已结婚，正文有女主完整成长剧情线；2、为了剧情需要，人物和大事件时间都有微调，有大量杜撰人物和事件，参考大量野史，谢绝考据；萝卜青菜各有所爱，如对本文剧情不喜请立刻止损点×，作者能力有限，别指望我能改，请选择符合你喜好的作者支持；3、正版读者人人平等，请勿拉踩喜欢本文的读者为作者的“XX”，我就一臭码字的，我不配；4、求求大家不要在其他文下推荐本文，也请别在本文下说其他文不好，给大家咚咚咚磕头了m（-_-)m。——接档文《李世民为弟弟心声头疼中》求预收藏——晋阳唐国公府有一对双生子。哥哥李世民身强力壮武艺高强，弟弟李玄霸自出生起药不离口。时人都称，双生子有奇妙的心灵感应。唐国公府二公子李世民证实，传闻是真的。在被李玄霸心中的惊人之语数次惊得面色大变后，李世民和双生弟弟商量。“阿玄，你知道你稍稍集中精神，哥哥就能听见你心里说什么吗？能不能别集中精神？哥哥不想听。”远近闻名的光风霁月病弱公子李玄霸：“我不。你不满，你也说啊。”身体健康，但精神力没李玄霸这么强的李世民，用尽全身力气，憋得满脸青紫，才在心底憋出了一个字。【啊！！！！！】李玄霸差点笑得抽过去。李玄霸前世是一个为了博流量，专门逮着李世民黑的历史营销号小编。一朝熬夜猝死，他胎穿成李世民那演义小说中有项羽之勇，事实上十六岁就病逝的双生病秧子弟弟。李玄霸：哦豁，报应。李玄霸：算了，摆烂。李玄霸：哥，你想听什么剧透，我都告诉你！李世民黑线：“我什么都不想听！！”多年后，李世民穿上了龙袍，手上沾满了鲜血。李玄霸仍旧病病殃殃，仍旧没死。一日，李玄霸在骂了魏征后倒地装晕碰瓷，李世民如幼年时一样，一把背起弟弟就跑。【哈哈哈哥，你没看到魏老匹夫那张脸有多扭曲！】【闭嘴！】【恭喜哥，你终于能说两个字了，嘻嘻。】李世民再次露出了头疼的表情，背着他不省心的弟弟，一步一步前行。注：本文根据正史改编，隋炀帝和李建成不是被埋没的千古一帝，有宅斗宫斗兄弟阋墙父子相残。只是李世民在走出人生的每一步时，都有个李玄霸趴在他背上瞎叨叨而已。不喜勿入，不用和我争论，请选择符合你喜好的作者支持。
169,他最野了,曲小蛐,原创-言情-近代现代-爱情,完结,485233,7384904192,"['天之骄子', '甜文', '校园', '轻松']",2019-03-08,（再版已签约，微博@曲小蛐）三中转校来了个哑巴似的小怪胎，永远穿着大一号的连帽卫衣和牛仔裤，一张小脸藏得严严实实。大家都以为她丑得吓人，哪想一朝露了脸，却惊为天人地漂亮。很快小美人全校闻名，正值青春期的男生们忍不住议论：“嚯，那就是新来的苏邈邈吧？”“跟个瓷娃娃似的，皮肤白得像雪！”男生们聊得热火朝天，不知道谁注意到了墙角懒散站着的少年。“彦哥，你见那小美人没？”有人发笑，“彦哥哪能注意那种小怪胎？”商彦没说话，漫不经心地瞥一眼，轻嗤了声。几个月后。当着全班学生的面，商彦把惊住的小姑娘挡在了课桌前。他低下头，勾起个痞气的笑——“你求我一句，我放你出去。”“……”“两句，我今后归你。”【IT大魔王x先心病小“怪胎”】“我有千般不驯，只为你妥协。”【注】1.彦哥学习超棒（除了语文）2.邈邈先天性心脏病，后期会做手术3.但这是超甜的文，不甜你们打我4.前期涉及计算机比赛，后期涉及数据分析团队创立，无原型*作者专栏欢迎收藏~追完连载的宝贝们可以康康蛐的其他完结文：[娱乐圈]《吻痣》（鬼才歌手&演技派小女星）[AI]《别哭》（温柔恬静小盲女 x 傲娇AI科技大神）[校园]《他那么撩》（学渣校草&小才女）[风投]《咬痕》（疯子&洋娃娃）[重生校园]《总有偏执狂想独占我》（偏执狂&小女神）
170,第二十八年春,耳东兔子,原创-言情-近代现代-爱情,完结,404109,7380466176,"['都市', '情有独钟', '制服情缘', '业界精英', '正剧']",2018-03-19,第二十八年春平淡慢热，不喜勿入。【一个很严肃的提醒：不要去任何包括但不限于扣扣、网易云等音乐、抖音、小红书等等的书中相关引用歌曲的评论区以及跟我文不相关的评论区去提我的文，不要打扰别人，谢谢大家！】4月5日入v。 谢绝任何形式扒榜←求包养，淘我的更多作品哦出版名更为《第二十八年春》上下两部。
