排名,书名,作者,类型,进度,字数,积分,标签,时间,简介
64,这题超纲了,木瓜黄,原创-纯爱-近代现代-爱情,完结,419370,12311825408,"['灵魂转换', '幻想空间', '甜文', '校园', '轻松']",2019-12-23,校园，互穿（间歇穿，会换回来的）七班许盛，从不穿校服，临江六中校霸史上最野的一位，各科均分30出头，处分通知拿到手软，隔三差五向全校进行检讨。烈日当空，少年声音张扬：“对不起，我下次还敢。”而号称考神的年级第一邵湛，高冷且不近人情。本应没有交集的两人却因为一次意外互换了身体。———老师看着结下梁子死活不愿意当同桌的两位少年。一个是他最头痛的不良学生许盛，一个是他引以为傲的优秀学生邵湛。老师沉吟两秒：“之前是谁说没有当同桌的缘分？”身穿黑色T恤和周遭格格不入的许盛倚着墙：“缘分来了。”老师看看另一个：“是谁说强扭的瓜不甜？”校服纽扣扣到最上头一颗，浑身上下像是刻着‘生人勿进’四个字的高冷学神：“强扭的瓜，不试试怎么知道甜不甜。”高冷不近人情屠榜杀手次次考第一学霸攻X翘课打架离经叛道学渣受邵湛X许盛 还是一本正经的搞笑文。强强你上北大，我上北大青鸟。内含瞎扯淡，不现实，有大量艺术加工，不要特意代入现实。和隔壁《学渣》同时间线，会有客串。微博：@炸天黄已完结文戳专栏。
65,两A相逢必有一O,厉冬忍,原创-纯爱-近代现代-爱情,完结,444590,11978259456,"['幻想空间', '甜文', '校园', '轻松']",2019-10-10,【该作品独家发布平台为晋江，其他任何平台的标注笔名为厉冬忍的作品非我创作且与我无关，请大家认准正版平台。保护自身的合法权益。】简松意出生的时候做了个基因检测，说他百分百会分化成一个顶级Alpha。于是他非常自觉地用十几年的时间成长为了一个日天日天的二世祖，校霸是他，校草是他，年级第一还是他。直到有一天小时候隔壁家的那个死对头转学回来了，不仅抢了他校草的位置，还抢了他的年级第一。最主要的是还他妈比他先分化成了一个顶级Alpha。对此，简松意表示，一山不容二A，不把柏淮这个王八犊子给赶走，他就不配当一个Alpha！于是老天有眼，当天晚上他就当着柏淮的面分化成了一只Omega。-简松意立志要当一只有骨气的Omega，就算他进入特殊时期了，就算他忘记带抑制剂了，就算他今天死在这儿了，他也绝对不会要柏淮标记他！柏淮只能低声哄道：“让我咬一口，期末考的年级第一，给你。”简松意受不了他信息素的诱惑，从了。等到考试成绩出来那天，简松意看着光荣榜上的“第一名 柏淮”，气得炸毛。“柏淮，你个大骗子！你又比我多考一分！”柏淮轻笑：“有什么不对么，我是年级第一，给你。”【ABO校园日常甜饼/无脑傻白甜/无生子/傲娇炸毛大少爷受X斯文败类攻】
66,骷髅幻戏图,西子绪,原创-纯爱-近代现代-悬疑,完结,716191,11967745024,"['魔幻', '惊悚', '天作之合', '悬疑推理', '轻松']",2020-02-08,林半夏好像被奇怪的东西盯上了。独自一人的家中总是充满了奇怪的异响，有敲击声却空无一物的衣柜，总是发出滴水声却并没有水的水龙头，还有窗外奇怪的咀嚼声。直到某个午夜。忽然醒来的他睁开眼，看到了一具白如雪的骷髅，趴在他家天花板上，扭过头咧着嘴冲他灿烂的笑。本文广播剧将于9月12日于网易云上线每天上午十一点更新~本文灵感是南宋画家李嵩的一副画：《骷髅幻戏图》，感兴趣的可以去搜搜看。本文纯属虚构，灵感来源克苏鲁和coc跑团，请读者们不要代入现实~感谢胖次太太提供的超可爱封面=3=周日入v，谢谢大家支持~
67,PUBG世纪网恋,酱子贝,原创-纯爱-近代现代-爱情,完结,430796,11880037376,"['情有独钟', '体育竞技', '甜文', '直播', '轻松', '电竞']",2018-10-18,玩游戏不咋滴胜在有钱有脸大老板攻 vs 刚枪贼6可爱骚话声控主播受本文又名《我的粉丝是我顶头老板》《你我本无缘，全靠你花钱》《全直播间水友都觉得我们在网恋》——吃鸡文，无原型不玩游戏也不影响阅读【非比赛】【日常】【直播文，弹幕较多】【逻辑半死不活，抢救无效，快乐就好】
68,杀破狼,priest,原创-纯爱-架空历史-爱情,完结,611067,11817466880,"['年下', '幻想空间', '正剧']",2015-01-23,HE【信我=w=温柔贤惠病娇年下攻VS废柴聋瞎受【信我=w=非主流蒸汽朋克=w=重要的事情说三遍：先出场的是攻！先出场的是攻！先出场的是攻！……但总体来看，本文不是主攻文=w=拜谢“骑驴看吧唧”同学的封面！更新频率为每天十一点整，有特殊情况会提前请假=w=专栏链接二月十二日周四VIP，以后长评送分，独家发布谢绝转载，请转载的诸位尽快撤文了，谢谢，再次感谢支持正版~
69,我死对头终于破产了,酱子贝,原创-纯爱-近代现代-爱情,完结,429794,11800274944,"['强强', '豪门世家', '情有独钟', '恋爱合约', '轻松']",2019-03-11,令纪燃不爽多年的死对头破产了。狐朋狗友问纪燃打算怎么办。纪燃冷笑一声——这他妈还用问？！那当然是趁机折磨他、羞辱他、践踏他啦:)于是纪燃大手一挥，把卡往死对头身上一丢，张狂地说要‘资助’他。结果第二天，他一脸懵逼的坐在床头，感受着身上的阵阵酸疼，想起昨晚受过的苦，挨过的“打”和流过的泪……草亏特么大发了。狗比秦满，我杀了你。——文盲式写文、逻辑已进土立碑、放飞自我、无文笔可言、攻受都不是善茬。
70,碎玉投珠,北南,原创-纯爱-近代现代-爱情,完结,314331,11798822912,"['豪门世家', '情有独钟', '欢喜冤家', '业界精英', '正剧']",2018-01-10,古玩行没一个缺心眼儿的。攻受都臭讲究。退一步兄友弟恭，进一步情有独钟，再进一步走完一生。白头偕老he丁汉白：“这行最喜欢的就是玉，料分三六九等，人也分龙凤蝼蚁，我既名汉白，自是配得起良玉。”纪慎语：“师哥一向都是拔尖儿的。”丁汉白：“既然拔尖儿，那配不配做你的良人？”（攻就是比较没羞没臊，非逼着人家跟他好）张狂事儿多大少爷·特级鉴宝专家攻，双商高长得美·古董制造达人受注意：番外为脑洞向，与正文无关，尬写。
71,不死者,淮上,原创-纯爱-近代现代-爱情,完结,395649,11465376768,"['强强', '欢喜冤家', '天作之合', '末世', '正剧', 'HE']",2017-04-19,——《帖撒罗尼迦前书 4:16》通讯中断，水电停止，化工厂泄露，核电站爆炸，城市沦为地狱焦土；生化危机丧尸题材ABO设定，AO配，人狠话还多帅不过三秒攻vs虽有战力爆表奈何一生点背受
72,灵异片演员app[无限],戏子祭酒,原创-纯爱-近代现代-剧情,完结,744775,11377972224,"['强强', '灵异神怪', '无限流', '爽文', '轻松', 'app']",2020-02-19,谢池，多重人格患者。表面斯文清隽，副人格却冷漠强势，武力值爆表。谢池从不谈恋爱，因为副人格就是他的男朋友。谢池的梦想是有一天，能拥抱他的爱人。为了实现梦想，谢池自愿绑定了灵异片演员app。app定期发布恐怖片通告，红衣怨灵、僵尸爱人、1552凶宅……被选中的演员将被投放进真实的恐怖环境求生。拍摄第一天，男一号把谢池堵在角落里，手脚不干净：“跟我，我帮你抢戏当男二号。”谢池笑得温柔，轻摇头：“那怎么够。”男一号愣。谢池微微一笑：“哥，帮我打爆他的狗头。”副人格朝男一号露出冰冷一笑。拍摄结束，男一号：谢池。别人：艰难求生。谢池：逆天改命。集绝对智慧和绝对武力于一身。从十八线做起，谢池终将是恐怖片影帝。>主剧情，感情辅，升级爽文，金手指粗，不太恐怖，偏解密>斯文败类高智商受x宠妻狂魔副人格攻>现实世界部分完全架空，灵感来源、引用、借鉴连载时已多次标注，可打开作话，有功能性其他cp>创作需要，设定瞎编，文盲式写作，经不起考究>封面左半边受，右半边攻，长得不太一样
73,满朝文武都能听到我的心声,白色的木,原创-无CP-架空历史-轻小说,完结,818007,11315609600,"['天之骄子', '穿越时空', '系统', '爽文', '轻松', '读心术']",2023-06-26,隔壁有完结文《我靠宠妃系统当了秦始皇的国师》，感兴趣的可以看一下＊古代奇幻轻小说坏消息：许烟杪穿越回古代了，而他本人四肢不勤五谷不分，专业还是对古人没用的网络空间安全。好消息：他绑定了一个系统。坏消息：系统名叫八卦系统，不是算命那种八卦，是包含别人私人信息和猛料的那种八卦。屁用没有。坏消息二：这个系统还坏了，产生的BUG未知。坏消息三：这具身体是个能混到参加朝会的小官，而他这个穿越者……不通四书五经，不会毛笔字，目测有被检举揭发科举舞弊的风险。许烟杪：“……”算了，躺平吧，等死吧，赶紧死了说不定还能穿越回去。……朝堂之上，皇帝因政事雷霆大怒，臣子们瑟瑟发抖。许烟杪假装认真听，实则专注翻八卦系统。【哇哦，皇上昨天刚纳了十六岁的贵人诶！一树梨花压海棠！老当益壮！而且被翻红浪一整晚没睡，现在声音还能这么激昂有力！厉害了！】【这贵人居然还曾经是皇太孙的外室，哇哇哇！太孙还懂掐腰红眼文学！】【哇哇哇哇！皇太孙闯进爷爷后宫……嘶——趁着老皇帝上朝的时候搞上了！搞快点搞快点！怎么没视频……】【诶？怎么没声音了？】许烟杪小心翼翼抬头，偷瞄四周。【发生了什么？怎么跪了一地？皇帝呢？】——皇帝去后宫捉奸了。＊“科举舞弊”这个炸弹终于爆发了。许烟杪没办法解释自己为什么笔迹和答卷上的笔迹不一样，也没办法回答自己为什么不通四书五经。痛失外室的皇太孙准备的证据直中要害，其贴身侍卫虎视眈眈，扑上来就要把许烟杪拖走打入大牢，秋后问斩。许烟杪捏着证明清白的八卦，却十分头疼：要怎么解释我的信息来源啊……【说我在科举前三天晚上私见主考官礼部侍郎？怎么可能，那天晚上礼部侍郎男扮女装，夜宿将军府，和大将军……】大将军虎躯一震，当场打断：“陛下！！！！”“虽说科举舞弊证据确凿，但臣认为此事仍有蹊跷，应当重审！尤其是许……许……许烟杪他衣冠整洁！如此重视衣冠的人，怎么会弄脏自己名声呢！”没办法听到心声的皇太孙：？【还有啊，说什么考官假装打哈欠和困倦是在特意给我留出抄袭的空档，他科举前夜还在母猪圈里呆一晚上不睡觉，第二天能不困吗？不过，堂堂翰林侍讲居然还会相信猪的奶……】翰林侍讲脸色一白，扑将出来：“陛下！！！”“臣……臣赞同大将军的话！许郎怎么会科举舞弊呢！他……他……他在考试前特意喝了一杯纯净的水，相信只有善良的人才能使用清净之物，如此善良的人，又怎么会去科举舞弊呢！”以为稳操胜券的皇太孙：？？许烟杪感动坏了。【都是好人啊，哪怕脑子不好使，也努力帮我找理由找借口。】【但是我真的没办法翻盘了，唉，可惜我追的连续剧没追完，老皇帝昨晚惹皇后生气，灰溜溜地被赶出寝宫，我还没看到结局就要死了，他今天回去好像打算要往脸上涂墨水假扮猫咪哄皇后开心……】“砰——”老皇帝一拍桌子，强行打断那源源不断的心声：“朕相信许烟杪没有科举舞弊！无罪释放！”满朝文武迫不及待附议，生怕慢一步许烟杪就能抖出其他八卦。“对对对！无罪释放！”“陛下圣明！”“陛下快下朝吧！快让许郎回家歇歇！都把他站得累坏了！”皇太孙：？？？许烟杪给你们灌迷魂汤了吧？
74,万有引力[无限流],骑鲸南去,原创-纯爱-近代现代-爱情,完结,1331753,11256925184,"['强强', '灵异神怪', '情有独钟', '无限流', '轻松']",2020-08-28,世界共享开放性互动交流游戏《万有引力》上线后，迅速风靡世界完美的生态系统、完全贴近现实的物理引擎、打通次元的游戏副本任君挑选尤其是灵异副本，好评如潮几乎所有人都以为自己在玩一款普通的游戏直到某天，数以百万计的人看到天际线上出现了一个对话框【sun.exe未响应。如果您继续等待，程序可能会响应】【您想结束这个进程吗？】【结束进程 取消】1、1v1，外冷内热微天然美人受x外热内冷略疯批美人攻，双控场，he2、攻有一半乌克兰血统，但是不秃（x）3、有恐怖情节，慎入
75,满级绿茶穿成小可怜,春刀寒,原创-言情-架空历史-爱情,完结,425527,11194250240,"['穿越时空', '青梅竹马', '宫斗', '爽文', '轻松']",2020-02-27,林非鹿外号绿茶公主心机茶中的战斗茶，民间奥斯卡影后卖得了萌，掐得了架，装得了无辜，演得了白莲反正不是个好人后来她为自己的行为付出了代价——死在二十七岁生日那天死的时候，林非鹿反思自己这二十多年的绿茶生涯，深深感到自责和后悔她发誓，如果有来世，她一定当个好人结果穿成了大林朝的五岁小公主母妃不受宠病恹恹，哥哥是个痴傻智障吃不饱穿不暖，还随时有生命危险生存环境非常恶劣想要当一个好人的林非鹿：……是你们逼我的对不起，只能开大了宫斗？争宠？上位？不好意思，让你们见识一下什么叫满级玩家屠新手村-----------------------孱弱的宋国送了一个小皇子来大林朝当质子小皇子生得漂亮俊俏，人畜无害，在大林朝过得水深火热重度颜控林非鹿常常施以援手帮助这个小可怜后来小可怜长成了大魔王回国弑父夺位，率十万铁骑陈兵淮河岸他穿一身玄甲，猩红披风猎猎作响，笑着说：回去告诉你们陛下，孤只要永安公主永安公主林非鹿：？？？想我堂堂一世绿茶，最后竟然折在了白切黑手上林非鹿：你演我宋惊澜：承让，孤与皇后互演罢了【前期主女主事业，感情戏靠后，不喜勿入】【背景架空，私设杜撰，爽文，非正经宫斗】【男女主都非善茬，文中人物三观不代表作者】【微博：@春刀寒】---------------新文《鬼怪游乐场[无限]》已经开始连载啦~【纯中式/民俗恐怖本】一个寻常的午后，名为[鬼怪]的高维灵异系统入侵了人类社会那天之后，各地见鬼事件频发，意外死亡率急速增加正当人类束手无策之际，[鬼怪]上线了全球直播：——叮！恭喜你被选中参加《恐怖综艺》~——因为你是备受观众喜爱的明星，拥有足够的关注度，所以才会被选中哦。请利用人气值在副本里活下去吧~你就是最闪亮的明星！——通关副本后人气值垫底的明星将会被淘汰，成为鬼怪的晚餐，要加油哦——要么红，要么死，嘻~常年在各大电视剧中跑龙套，毫无知名度的小演员黎知看了看左边的顶流爱豆，又看了看右边的国民初恋露出了坚强的微笑——从默默无闻的小演员到副本人气断层第一的明星玩家——从无到有——从有到毁灭【当这个世界沦为鬼怪的游乐场，我仍没有忘记我是一个人类】
76,坠落,甜醋鱼,原创-言情-近代现代-爱情,完结,382658,11160435712,"['情有独钟', '天之骄子', '轻松']",2022-03-19,【《坠落》完结篇将于3月30日晚19:00开启预售】周挽X陆西骁阳明中学大家都知道，周挽内向默然，陆西骁张扬难驯。两人天差地别，八竿子打不到一块儿。谁都没有想到，有一天这两人会站在一起。接着，流言又换了一种——陆西骁这样的人，女友一个接一个换，那周挽就凭一张初恋脸，不过一时新鲜，要不了多久就会惹陆西骁生厌。后来果然，周挽转学离开，陆西骁如从前一般游戏人间。一切像是从没发生过。直到那晚酒醉，他疯了一样给周挽打电话，被挂断又重拨，直到周挽终于接起。她没说话，陆西骁也不说话。两人较劲。直到陆西骁低下头，强撑最后一丝尊严：“周挽，只要你说一句爱我，我就都原谅你。”少女嗓音清冷，唤他名字：“陆西骁。”就这三个字，陆西骁眼眶红了。她极为冷静地说：“我不爱你，是我一直在骗你。”这段感情中，陆西骁从来不占主导。他是被玩的那个。*那个电话的最后，他们闹得很僵。陆西骁说，周挽，别让我再见到你，否则我一定让你哭着求我。后来再重逢是在灯红酒绿的酒吧街上。陆西骁又成了玩世不恭、离经叛道的样儿，旁边站着个娇俏姑娘点烟。他看到周挽的瞬间，神色平静，移回视线，继续跟旁边人继续谈天说地。像是早忘了。周挽只说了三个字便让这一切伪饰分崩离析。“陆西骁。”她依旧是那平静到清冷的嗓音。陆西骁丢了烟，大步上前，拽着周挽的领子将文气温柔模样的女人推到墙上，他暴怒到额头青筋暴起。“周挽，你还敢回来，你还敢回来。”他身上混杂酒精和烟草的气味，咬牙一字一顿问，“你是不是想死？”*总有人爱你花团锦簇，也爱你满身淤泥。表面：乖乖女X浪子实际：负心女X回头浪子
77,我是龙傲天他惨死的爹[穿书],青衣杏林,原创-纯爱-架空历史-仙侠,完结,4719919,11153875968,"['仙侠修真', '穿书', '爽文', '轻松', '龙傲天']",2022-01-11,【重要提醒：本文目前未出实体书，如若见到本文实体书一律为盗版，请勿购买!请勿购买!已联系编辑处理。】文案：秋意泊一朝穿越修仙界，本以为要开始残酷奋斗与天搏命的一生……——好嘛，天灵根，家族嫡长子，躺着也能自动修炼，资源按月发放。这一世他！躺！赢！了！六岁那年，秋意泊突然发现他穿越的其实是一本起点流修仙小说里，男主是他儿子，经典废柴逆袭流，顶着退婚、家族血仇、重修灵根标准三部曲一路修炼到天帝的故事。好家伙，他儿子是龙傲天！等等！——那他岂不是就是龙傲天惨死的爹？为了避免剧情线的发生，秋意泊决定……这儿子他不生了还不行吗？！正所谓不婚不育，仙龄永继！不生不养，万寿恒昌！#只要我够强，就没有人能杀我全家！#***“秋家家主大婚？他不是修无情道吗？跟谁？！”“跟他多年前分出去的分神。”#无情道大佬今天又震惊到我# CP：自攻自受，二逼沙雕咸鱼本体受X邪魅炫酷狂拽分神攻入V 通知：本文2月2日入V，届时三更，感谢大家-3-关于更新：每日晚24点左右更新，有时会晚，真的不更新会上请假条关于防盗：订阅70%以下读者将在720小时内无法购买最新章节，本文非多副本类型，跳过章节过多将影响阅读体验————【划重点：主受，升级流，修仙，感情戏少，自攻自受，攻很晚才出现，不生子，不宫斗，配角好坏都有，反派男女都有，偏日常系。主角完全体天下第一，如果攻受对砍，攻弱受强。】————高亮声明：本文对于道家经典、术语、法咒等相关内容在部分书籍、百度百科、口诀综合帖将出现高频次引用，部分在连载时已标注，部分或许有遗漏，在此先声明这些专业的东西都是引用的！引用的！引用的！完结后会将参考书目等放到专栏《参考资料》中。本故事纯属虚构，不具备任何参考价值，请勿迷信。预收：《这座山头被我承包了》主受欢乐日常赶山文     沉楸是一个996社畜。爷爷去世十年后，他意外被神庙重建系统绑定，被迫辞去了大城市的工作，回到老家继承山头，以及一座破败不堪的山神庙。面对着被‘精怪’烦扰的村民们，沉楸秉持着科学至上的原则，硬着头皮为伪玄学手段为小青山带来了安宁，也顺利重建了山神庙。*村民甲：“沉师傅，救命！我家似乎是得罪了黄仙，鸡都被咬死了！”沉楸抹了一把脸，拎出了铁笼：“遇到事情不要慌，首先，我们先下个黄鼠狼笼。”村民乙：“沉师傅，我们家猪中了邪，它、它半夜唱歌啊！”沉楸一脸沉着：“莫慌，这是吉兆！这必然是山神爷爷选中了它！今天就请个杀猪匠把它收拾干净，明天我就开香案摆祭坛供奉山神爷爷！明天完了事儿大家伙一起吃杀猪菜！”*在小青山村民眼中，他们的新庙祝是一个高深莫测的大人物。自对方上任后，村里的黄鼠狼不再肆虐，家里的老鼠不再绕着房子跳舞，家猪半夜不再蹦迪，小青山一派欣欣向荣。然而，被村民们敬畏着的沉楸却面临着新的烦恼——他亲手为山神的眼尾染上了一抹金红的色彩，那座神像……哗得一下睁开了眼睛。这……问题有点大了。思来想去，沉楸拨通了某个电话。 “喂110吗？我有东西想上交给国家！”二逼沙雕赤脚庙祝受X高冷美人山神攻，主受，没有大BOSS大阴谋吃吃喝喝撸毛茸茸的赶山文
78,老婆粉了解一下[娱乐圈],春刀寒,原创-言情-近代现代-爱情,完结,570071,10856675328,"['穿越时空', '娱乐圈', '甜文', '爽文', '轻松']",2018-12-10,作为人气偶像霍希的老婆粉乔瞧最讨厌的人就是捆绑霍希炒绯闻的女明星盛乔日常除了扛着相机追活动，就是实名diss这个白莲花没想到一朝撞到头，醒来后她成了盛乔与霍希首度合作的爱情剧拍摄过程中，第一场戏NG了二十七次霍希：盛乔，你到底能不能行？不能行换人！乔瞧：老公你别生气啊，我行的！霍希：？？？媒体：《盛乔漏嘴喊出亲昵称呼，霍希隐婚曝光》霍希粉丝：cnm盛乔你这个莲花婊快出来道歉澄清！隔日，盛乔微博解释：那个……老婆粉你们了解一下？绝地反击，逆风翻盘，强势挽尊【女主从全网黑嘲到全网追捧，顺便和爱豆谈个恋爱】当红小花盛乔最近被拍到跟影帝在交往霍希接受媒体采访时，记者请他给这位圈内粉丝送上恋爱祝福他冷冷看向镜头：假的。盛乔微博忙不迭辟谣：我独唯，不爬墙，谢谢大家。当晚，爱豆在她耳边咬牙切齿：公布恋情，立刻，马上。【存稿充足，每天定时双更，不虐不渣，甜苏爽，请放心跳坑~】【追星文/追星少女的日常/粉圈常态/】【各角色没有原型！没有原型！没有原型！】【微博：@春刀寒】=============================新文《鬼怪游乐场[无限]》已经开始连载啦~【纯中式/民俗恐怖副本】一个寻常的午后，名为[鬼怪]的高维灵异系统入侵了人类社会那天之后，各地见鬼事件频发，意外死亡率急速增加正当人类束手无策之际，[鬼怪]上线了全球直播：——叮！恭喜你被选中参加《恐怖综艺》~——因为你是备受观众喜爱的明星，拥有足够的关注度，所以才会被选中哦。请利用人气值在副本里活下去吧~你就是最闪亮的明星！——通关副本后人气值垫底的明星将会被淘汰，成为鬼怪的晚餐，要加油哦——要么红，要么死，嘻~常年在各大电视剧中跑龙套，毫无知名度的小演员黎知看了看左边的顶流爱豆，又看了看右边的国民初恋露出了坚强的微笑——从默默无闻的小演员到副本人气断层第一的明星玩家——从无到有——从有到毁灭【当这个世界沦为鬼怪的游乐场，我仍没有忘记我是一个人类】
79,空降热搜[娱乐圈],颜凉雨,原创-纯爱-近代现代-爱情,完结,870101,10783141888,"['都市', '欢喜冤家', '娱乐圈', '励志', '轻松']",2017-06-17,始于“微博热搜”的娱乐圈爱情。——————————1、日更，HE，每天晚上19：00更新，如有事一定会挂请假条，么么哒。 2、所有角色纯属虚构，小伙伴们千万不要带入三次元明星，尊重所有艺人和粉丝，比心(づ￣ 3￣)づ 
