排名,书名,作者,类型,进度,字数,积分,标签,时间,简介
1,天官赐福,墨香铜臭,原创-纯爱-架空历史-爱情,完结,1093083,69981937664,"['灵异神怪', '情有独钟', '仙侠修真', '励志', '轻松']",2017-06-16,订阅请注意：█【1-220章】为天官赐福完整版全文+番外。看文仅购买这一部分即可，不用全文购买的！█【221-247】为连载版里删除的内容节选，供部分旧版读者参考。不购买此部分不影响看文，请酌情考虑是否购买。█新增剧情较多，无法一一标注，比较集中的部分在章节简介里有提示。【248-252】的锁章为废稿，不看不影响阅读。█因为内容调整，现在的章节内容和以前的评论是错位的。简体实体书已上市，出版解锁不易，感谢大家的包容和支持（*＾＾）/~~为你，所向披靡！C天R地小妖精攻×仙风道骨收破烂受 啊那个收破烂的天界公务员，跟鬼界第一大佬有一腿！ PS： ●主受1V1HE，攻受都为彼此神魂颠倒。 ●攻第7章出场第13章露脸。 ●首刷千万别看评论，剧透防不胜防，非常影响阅读体验。同样，也请大家忍住，一定不要在前面章节的评论里剧透，这对后来的读者不友好也不公平。 ●不要相信“先看XXX章”之类的话。不但根本看不懂，还会被严重剧透。所以也请大家千万不要对后来的读者这样开玩笑。 ●预防针：一三五卷为现在时，二四卷为过去式。十分慢热，也许不热。有历险，有日常。时而乌龟慢爬，时而野狗脱缰。 ●最重要的：喜欢便留，不喜便散，不必勉强。感谢。
2,某某,木苏里,原创-纯爱-近代现代-爱情,完结,438115,42314842112,"['花季雨季', '情有独钟', '破镜重圆', '校园', '正剧']",2019-08-07,盛望搬进了白马弄堂的祖屋院子，一并搬进来的还有他爸正在交往的女人。他爸指着那个女人的儿子对他说：叫哥。桀骜不驯吃软不吃硬的制冷机（攻）x自认很金贵的懒蛋小少爷（受）盛望：我笔直。江添：我恐同。1v1+he
3,全球高考,木苏里,原创-纯爱-近代现代-剧情,完结,589514,40028422144,"['强强', '无限流', '相爱相杀', '未来架空', '轻松']",2018-10-10,全球大型高危险性统一考试，简称全球高考。真身刷题，及格活命。考制一月一改革，偶尔随机。梗概：两位大佬对着骚。1v1，HE，通篇鬼扯。
4,欢迎进入梦魇直播间,桑沃,原创-纯爱-近代现代-悬疑,连载,3679513,39958536192,"['强强', '无限流', '爽文', '升级流', '正剧']",2021-11-07,【最后一个副本进行中】温简言最擅长见人说人话，见鬼说鬼话。某日，他突然被迫成为了梦魇直播间中的一位新手主播，真的会死那种。温简言：“……”我rnm某新人成为最受瞩目主播，原因竟然是太会坑人，而且还是坑人坑鬼无所不坑。这家伙迟早翻车！幸灾乐祸看热闹的观众越来越多，可怎么等也等不到那一天。不过……为什么这个直播间的任务越来越奇怪了呢？【高级主播支线任务：亲吻恶灵三十秒】【奖励：未知】【顶级主播主线任务：脱衣诱惑邪神三分钟】【奖励：未知】观众：哦豁，主播这是掌握了新的财富密码吗？快点快点，有什么是我们付费观众不能看的！顶级BOSS步步逼近，低声诱惑：“怎么样？炒cp吗？假戏真做那种。”温简言：“……”？？？对不起，我很有原则的，骗人不骗心的谢谢。——你不要过来啊！wb@桑沃君不想码字阅前小tip：1.直播间观众不是主播！不是主播！不是主播！2.本文直播间内均严禁剧透，观众无法向主播透露副本内容或其他主播动向，主播之间禁止剧透，无法交流3.全文背景架空4.连载期长，可能经常看心情改换封面，建议不要因此吵架，因为每一个大概率都不会待太久（？ps：wb会放出所有过往封面5.不保证日更，以灵感为基准调整更新频率6.段评已开，请勿在段评内剧透后续发展！！发现会删除！！————预收：《人类最强被肃清后》文案：物种异变，末日降临，紧急应对小组成立。谢罔，紧急应对小组组长，人类坚实的最后壁垒，正直冰冷的雪亮刀锋。人们敬仰他的强大，也见识过他的恐怖。他既能拔刀护住身后的最后一个人，也能无情地下令处理掉一城的疑似感染者，只为将祸患的种子在源头掐灭。正因如此，在一切结束之后，他也成为了第一个被肃清的对象。待死亡的阴影散去，谢罔却发现，自己回到了末日发生之前，耳边还多出一个奇怪的声音。“瞧瞧，这就是当个好人的下场。”系统笑嘻嘻地说。“什么人类破晓之光，末日最强之剑，一旦没用了，不还是把你弃如敝履？”甜蜜的声音向他的耳朵里灌注着仇恨的毒药：“怎么样，想不想复仇？杀光那些把你当做工具的人类，让他们为所作所为付出代价，只要——”谢罔面无表情地听着耳边的絮语，拎刀走出房间，打车直奔200公里外的A市，给出的地址具体到了市区街道和小区名字。系统错愕：“啊？你去哪？”“等等等等，方向不对——”谢罔：“异种之王的老巢。”他终结过一次末日，自然也能终结第二次。系统：“……”干。我他妈能不知道你去的是哪吗！那就是我家！【混乱邪恶x极端正义】++++【假系统真反派异种之王攻x人类之光最强战力受】——他是永不弯折的刀锋，尖锐笔直，从不惘然。
5,我行让我来[电竞],酱子贝,原创-纯爱-近代现代-爱情,完结,539391,36252696576,"['体育竞技', '游戏网游', '甜文', '直播', '轻松', '电竞']",2020-06-28,LOL某场比赛，某知名气人主播正在解说并转播。主播：这辅助，真下饭。主播：打野如果是我队友，我现在已经挂在泉水为他弹钢琴了。主播：我建议这位选手回去好好练练他的补兵。观众：口嗨个p！你行你上啊！主播：你爹我还真行。观众：嗯嗯嗯:)你行我头砍下来给你踢。几个月后，LPL老牌战队TTC公布新中单选手，染着张扬蓝发的男生出现在观众的视野里，一手劫玩得出神入化，谁见谁死，女粉们纷纷在爬墙的边缘试探。MVP赛后采访，所有人屏住呼吸，一脸期待地看着这位新鲜血液。只见男生接过麦，笑着问：“星空tv用户ID叫‘郊区王者101’的那位水友，官网有我战队地址，你头什么时候寄过来？”·某场常规赛结束，工作人员去后台催战队成员上场接受采访，却在角落看见了TTC的新中单和打野。TTC第一王牌·打野爸爸Road正把他们队伍的新中单Soft怼在墙上，垂眼缓声问：“一会采访，知道该怎么做？”那位第一次上场就把自己的喷子形象钉死在观众心目中的暴躁中单，此刻整张脸红透：“知道。我不骂人……一定不骂人。”——路柏沅(攻)x简茸(受)没原型，没原型，没原型大约有两三章的女装情节。*原名/出版名《我行让我上》^^请求大家不要在本文相关以外的任何地方提及这篇文。拒绝拉踩，拒绝ky，拒绝空口鉴，从soft亲爹们做起。大家看文就好。感谢
6,判官,木苏里,原创-纯爱-近代现代-奇幻,完结,539210,34553692160,"['强强', '灵异神怪', '轻松']",2020-04-27,花里胡哨的“菜鸡”x住着豪宅的穷比判官这一脉曾经有过一位祖师爷，声名显赫现在却无人敢提，提就是他不得好死。只有闻时还算守规矩，每日拜着祖师青面獠牙、花红柳绿的画像，结果拜来了一位病歪歪的房客。房客站在画像前问：这谁画的？闻时：我。……别问，问就是感动。封面感谢@风漱
7,死亡万花筒,西子绪,原创-纯爱-近代现代-爱情,完结,857083,34062487552,"['灵异神怪', '乔装改扮', '无限流', '升级流', '正剧']",2018-01-12,起初的异样，是家里的猫不让抱了。林秋石发现周围的一切都开始变得充满了不协调感。然后某一天，当他推开家中的门，却发现熟悉的楼道变成了长长的走廊。走廊的两头，是十二扇一模一样的铁门。故事由此开始。阮南烛对林秋石说，当你凝视深渊时，深渊也在凝视着你。林秋石听后陷入沉思，然后对着深渊拉下了裤子拉链……阮南烛：“……你把裤子给我好好穿上！”不皮会死病娇攻X一起皮的沉稳受，双皮奶组合，灵异风格升级流。周四入v，希望大家继续支持谢谢=3=
8,破云,淮上,原创-纯爱-近代现代-悬疑,完结,817354,33642414080,"['强强', '制服情缘', '业界精英', '悬疑推理', '正剧', 'HE']",2017-12-15, 城市天空，诡云奔涌三年前恭州市的缉毒行动中，因总指挥江停判断失误，现场发生连环爆炸，禁毒支队伤亡惨重。三年后，本应早已因过殉职并尸骨无存的江停，竟奇迹般从植物人状态下醒来了。英魂不得安息，他必须从地狱重返人间，倾其所有来还原血腥离奇的真相。在本文人设中，严峫表面痞段子手但心细如丝且非常正气，江停智商很高身体素质很差，说话反复斟酌性格克制谨慎，表面温文儒雅但行事作风带邪性。两个主角人设清晰自洽，没有任何原型，不可作为任何代餐。现代都市刑侦，英俊潇洒十项全能进可百米狙人头退可徒手拆炸|弹没事就爱装个逼的攻&因为反正随时准备完蛋所以不管发生什么事都很淡定的受正常每周更六休一，HE
9,破云2吞海,淮上,原创-纯爱-近代现代-悬疑,完结,855167,32826472448,"['强强', '天作之合', '制服情缘', '悬疑推理', '正剧', 'HE']",2019-05-10, 那些窥探的触角隐藏在互联网浪潮中，无处不在，生生不息，正逐渐将现代社会的每个角落淹没至顶。“深渊中隐藏着庞大、复杂、根深蒂固的犯罪网，‘马里亚纳海沟’远比警方所知的更加深邃，却又近在你我身后——”津海市公安局新来的吴雩温和懦弱、寡言少语，对来自严厉上司的刁难毫不在意，只想做个按时领工资混饭吃的背景板。没人知道这个年轻人有一颗被毒枭重金悬赏的项上头颅，和曾经深渊屠龙的少年肝胆。本文人设灵感见原文第125章作者有话说部分。步重华与吴雩都有被人生境遇逼迫压抑到极致后的扭曲爆发特性，人设非常清晰完整，主角塑造没有任何原型，不可作为任何代餐。现代都市刑侦，作风冷淡严厉强势注重健康热爱养生学院派精英攻&得过且过不想干活平生最烦学院派最讨厌被领导的受每周正常更六休一，HE
10,撒野,巫哲,原创-纯爱-近代现代-爱情,完结,899776,29431207936,"['强强', '轻松']",2016-10-30,校园文。HE。更新时间周一二三五六晚7点40。写不出文案的作者跪在这里。封面字体感谢@零雨其蒙蒙！小线人感谢@二喜砸果叽！
11,放学等我,酱子贝,原创-纯爱-近代现代-爱情,完结,382237,28637343744,"['花季雨季', '情有独钟', '破镜重圆', '校园', '轻松']",2022-01-04,喻繁看班里那位新来的转班生非常不爽。对方朝他看了一眼。喻繁：他在找我约架。第二眼。喻繁：他问我是不是怂了。第三眼。转班生依旧顶着那张面无表情的冰山脸，递给他一封信：“喻同学。”喻繁心想学霸就是臭讲究，打架还递挑战信，抡起衣袖站起身。“请你收下我的情书。”喻同学敦地一下坐回去了。——陈景深（攻）x喻繁（受）日常，慢热请求大家不要在本文相关以外的任何地方提及这篇文。请求大家不要出去拉踩、ky、空口鉴。大家看文就好。感谢
12,魔道祖师,墨香铜臭,原创-纯爱-架空历史-爱情,完结,691111,28620851200,"['灵异神怪', '情有独钟', '天作之合', '仙侠修真', '正剧']",2015-10-31,前世的魏无羡万人唾骂，声名狼藉。被情同手足的师弟带人端了老巢，纵横一世，死无全尸。曾掀起腥风血雨的一代魔道祖师，重生成了一个……脑残。还是个人人喊打的断袖脑残！我见诸君多有病，料诸君见我应如是。但修鬼道不修仙，任你千军万马，十方恶霸，九州奇侠，高岭之花，但凡化为一抔黄土，统统收归旗下，为我所用，供我驱策！蓝忘机（攻）×魏无羡（受）高贵冷艳闷骚攻×邪魅狂狷风骚受调戏不成反被【哔——】PS：●1V1主角受HE。●前世今生双线剧情，夫夫解谜打怪打孩子。●为了创造一个纯粹的书评环境，评论区希望大家可以专注讨论小说本身的内容~请不要讨论其他内容，更不要因此吵架，不要以任何理由互相攻击哦！如果看到不合适的评论，无需回复，轻点投诉即可。守护评论区需要每一位书友共同努力，谢谢大家了！●感谢大家为了保护首刷读者，忍住剧透和预警剧透。不过，晋江有规定评论不能是大段无意义的重复内容，会被清理掉的。所以，如果是想提醒首刷读者小心评论剧透，轻轻地简单提醒一句就好啦，不用叠罗汉昂。
13,我在无限游戏里封神,壶鱼辣椒,原创-纯爱-近代现代-爱情,完结,2573738,24604950528,"['灵异神怪', '无限流', '爽文', '直播', '正剧']",2020-06-24,正文已完结白柳在失业后被卷入一个无法停止的直播游戏中，游戏中充满了各种各样的怪物和蕴含杀意的玩家一开始所有人都以为白柳只是个误入游戏的普通人后来，他们才明白，是这个游戏用胜利和桂冕在恭迎属于它的神明，对白柳说，欢迎回家恐怖神明非人类美攻*特别爱钱随便炸场有点疯受参考了跑团，克系等科幻灵异世界观，非现实纯架空世界，所有都是私设阅读注意事项：大男主无限流慢热升级流爽文排雷：主剧情，感情戏份极少，攻切片，大大大长篇，受是中二杰克苏，还很万人迷，雷点可能相当密集，介意这些读者慎入，如果怕被雷的读者也可以等完结之后等其他读者排雷之后再入本文为现实架空游戏设定，与现实毫无关系，请大家不要代入现实欢迎各位踊跃评论点评，正负零分都可以，但如果中途看得真的很不爽，还是建议大家及时止损，骂我几条就可以弃文了，不用相信别人安利时说什么【这本文后续会很好看】忍着看下去，这文后面和前面差不多水平的，所以当你觉得前面看得不爽，我真诚建议快跑.jpg，花钱看文的读者没必要让自己受这个委屈但激烈人身攻击，引战拉踩等违背晋江规定的评论我是会申请删除的，请大家不要去其他人的文下提我的文，我在其他文下看到了会举报的，视频也是防盗比例百分之五十，购买达到比例后的读者如果不能看新章可以尝试清理缓存，或者拨打客服，更新时间一般在晚上，V后应该会经常加更希望大家和谐讨论，开心看文
14,不见上仙三百年,木苏里,原创-纯爱-架空历史-爱情,完结,533344,24029347840,"['强强', '仙侠修真', '相爱相杀', '甜文', '正剧']",2021-11-30,世间邪魔千千万，照夜城里占一半。至于剩下那一半，全都死在了天宿上仙萧复暄所掌持的苍琅北域里。只有一位魔头被囚锁了二十五年，却依然活着。就是照夜城主乌行雪。
15,AWM[绝地求生],漫漫何其多,原创-纯爱-近代现代-爱情,完结,330466,23825217536,"['情有独钟', '破镜重圆', '体育竞技', '甜文', '轻松', '电竞']",2018-01-24, 电竞新文《FOG[电竞]》连载中，感谢支持。《AWM绝地求生》正版周边现已上市。感谢支持。购买店铺：HOG电子竞技俱乐部《AWM绝地求生》正版简体书现已上市。感谢支持。购买地址：翰联天猫店 当当网 现代电竞     甜度：++++++电竞明星大神慵懒老流氓队长攻X外硬内软孤僻新锐队员受【主角配角均无原型，谢谢大家】AWM：PUBG游戏中伤害最高获取最难的怪物大狙，空投终极梦想，威力足伤害高，无视任何头部防具爆头一枪倒地，唯一缺点：几率产出，获取极难，全凭运气。你是我的AWM的意思就是：你是我的可遇不可求。  推荐cp千鹤的现代甜文—>《迪奥先生》    专栏，求收养
16,洄天,淮上,原创-纯爱-近代现代-奇幻,完结,709033,22768508928,"['强强', '异能', '现代架空', '悬疑推理', '正剧', 'HE']",2022-12-17,一场流星雨带来大量放射性陨石，造成全球十万人突发进化，异能由此产生，动荡与恐慌接踵而来。为了稳定社会结构，全球各地纷纷成立监察处，旨在用一切力量解决异能犯罪，保障公共治安。申海市大监察官沈酌以冷酷强硬、铁腕高效的行事风格而闻名，进化者们敬畏他，痛恨他，也不得不服从他。关于他的流言大多集中在两方面，一是血腥有污点的过往，二是他冰冷沉默但美貌的脸。热爱维护核平强得日天日地天生热衷雄竞从来屡竞屡胜轻佻嘴欠的逼king攻&位高权重美强惨狠一生双标懒得掩饰的受本文跟现实毫无联系，纯属架空虚构没有原型不可代餐这口腿肉不适合控控口味偏好强烈的读者食用因为想吃但找不到粮所以自割腿肉爽一把因为是自吃自粮所以偶尔会没有理由地展开飞翔正常每周更六休一，有事会提前请假，HE~
17,直播写纯爱文的我在虫族封神,MRA,原创-纯爱-幻想未来-爱情,完结,2048118,22425112576,"['爽文', '直播', '逆袭', '虫族', '轻松']",2023-03-19,【全文完结】【假温柔病弱真腹黑精明攻x冷漠阴沉高岭之花实则口嫌体正直纯情恋爱脑受】时寸瑾是一位知名小说家。谈完大项目当晚，他眼一闭一睁，穿书变成一只废物雄虫。时寸瑾：？原著烂尾，HE转BE。必须要掰正剧情，穿书系统才放他回去，偏偏系统虚弱到休眠，时寸瑾穿越当晚差点落地成盒。低配+天崩开局，死了算…算个屁！我刚谈完的大项目！比起救剧情，还是先想想怎么救自己吧！时寸瑾融合记忆发现虫族世界文化贫瘠，干脆捡起老本行连夜在星网直播写文，开播名字上去就是一个经久不衰震惊体：【室友老是穿得很厚，有天回去早，意外发现他竟然有尾勾？】路过雌虫：等等？路过雌虫：什么？无数虫震惊点进这个直播间……直到下播都没人走。新号开播当晚，空降top榜！时寸瑾一战爆火，纯爱战神席卷糙汉虫族世界观！越来越多雌虫蹲守直播间，嘲讽蔑视直说不可能有雄虫阁下会这样！——然后耿直打赏。继[室友]后，主播又推出[同事]、[医生]…等系列纯爱狗血小说令这群单身寡雌欲罢不能！狂热追捧！谁都想知道主播是谁！可没虫能找到。直到有一天向来准时的主播发了停播通知：【卷入胡蜂族大战，星网不稳定，停更。】守着直播开播的百万雌虫：？？？悄悄潜水追更的双方统领：……停战！紧急停战！先把老师送出去！！内战可以输，单身雌虫梦之信仰不能死！！*——早在发出通知前，时寸瑾就已脱离危险。谁能想原作者笔力驾驭不住的狂气拽比受，私底下其实爱追狗血故事，还悄悄成为他的榜一，网恋上头愿意直冲战区救cp这会酷哥脸上带血，眼神阴桀，神情恐怖骇人。可那双搂着雄虫的手正不停发抖，动作局促又紧又勒，时寸瑾被抱得不舒服挣了一下。阿努什卡立刻单膝跪下小心牵住他的手，有点语无伦次的颤抖道：“…不，别怕，对不起，我马上使用抑制剂。”时寸瑾没忍住，摸了摸他的金发。——1-【主攻】时寸瑾x阿努什卡，锁死禁止拆逆。2-文中所有情节发展均为推动剧情而服务，星际虫族属于幻想架空题材，请勿脱离剧情讨论，请勿带入现实，请勿混淆现实与虚拟小说的界限，网络小说请勿上纲上线。3-别在本文评论区提及其他作者的文，也别在其他作者评论区提及本文，尊重他人创作成果。4-评论区请友好交流，和平讨论，禁止人身攻击，请尽量别写带颜色的段子，走进评论区遍地裤子实在太过超前。6-吵架伤财运，祝大家恭喜发财。专栏预收《非传统求爱法则》求收藏^^
18,烈火浇愁,priest,原创-纯爱-近代现代-奇幻,完结,783098,21835843584,"['强强', '幻想空间', '古穿今', '都市异闻', '正剧']",2018-12-31,“在岩浆的浪尖上，有烧不完的余烬。”古穿今，年下。感谢老福特上“橙子绿呀绿”小盆宇的封面图=w=字写得敲美丽
19,营业悖论[娱乐圈],稚楚,原创-纯爱-近代现代-爱情,完结,666343,21342275584,"['年下', '情有独钟', '娱乐圈', '轻松']",2020-01-29,【《可爱过敏原》已完结，欢迎前往阅读~】入坑本文前请看排雷~有实力却很糊的男团Kaleido，偶然因一段机场他拍视频走红。视频里，全团最攻的老幺裴听颂把哥哥方觉夏抵在墙上，手拿机票轻拍他的脸，而方觉夏却只是拿走机票叼在唇边，整理衣襟。一场团内“霸凌”变身成刺激互撩，听觉cp横空出世。于是，潜规则传闻缠身的被弃王牌和传说中的带资空降背景户就这么捆绑在一起，明明出道就不合，却被迫开启漫漫虚假营业路。主舞主唱门面·理智坚韧美人受vs创作/rap/总攻担当·叛逆不羁年下攻人生是一场关于营业的悖论。【排雷】1、[队内恋爱]，不喜勿入！2、受有潜规则传闻（没被潜会澄清），双初恋，感情线无虐3、架空娱乐圈，不写实勿较真。认为“明星有文化”这个设定很违和的请勿入，前中期有烧脑真人秀，不喜勿入。4、攻受开局关系差，开篇性格只是冰山一角，完整人设铺展很慢，别骂角色，不喜就弃5、无原型！【请勿提及三次元，这么个小糊团谁代谁糊】，谢绝换头，请勿侵权6、男团文有舞台所以会有不少原创歌词，不喜勿入7、会登顶有爽点但[非快节奏爽文]，【谢绝写作指导】，别勉强自己看文，开心最重要。8、请勿去其他地方ky，圈地自萌。9、请勿拉其他文来比较（或拿着这篇文拉踩别的文，都很ky），看书就好。
20,FOG[电竞],漫漫何其多,原创-纯爱-近代现代-爱情,完结,510136,21277171712,"['轻松', '电竞']",2019-07-30,+现代电竞+男神VS男神医疗师攻X突击手受【主角配角均无原型，谢谢大家】推荐绿野千鹤老师的现代血族新坑《以牙之名》
21,将进酒,唐酒卿,原创-纯爱-架空历史-爱情,完结,1041869,20814985216,"['强强', '宫廷侯爵', '情有独钟', '天作之合', '正剧']",2018-10-01,【有修改提示皆是在解锁中】浪荡败类纨绔攻vs睚眦必报美人受。恶狗对疯犬。中博六州被拱手让于外敌，沈泽川受押入京，沦为人人痛打的落水狗。萧驰野闻着味来，不叫别人动手，自己将沈泽川一脚踹成了病秧子，谁知这病秧子回头一口，咬得他鲜血淋漓。两个人从此结下了大梁子，见面必撕咬。“命运要我一生都守在这里，可这并非是我抉择的那一条路。黄沙淹没了我的手足，我不想再臣服于虚无的命。圣旨救不了我的兵，朝廷喂不饱我的马，我不愿再为此赴命。我要翻过那座山，我要为自己一战。”  1v1，HE，HE，HE。每晚19点更新。【大纲已完成，我知道我在写什么，我希望大家看清楚HE，稍微尊重一下我，感谢。】【预警】1、主cp萧驰野x沈泽川，萧攻沈受。2、有条百合线，还是重要角色。3、攻比之前几本的哥哥们更加混账。4、作者是个没文笔的大魔王，练节奏。5、我给磕头了各位大爷，看文案，看文案，【看清文案】。不要给作品戴高帽，架空标签从头到尾没变过，涉及剧透的长评请去该去的章节。
22,小蘑菇,一十四洲,原创-纯爱-幻想未来-科幻,完结,313845,20419121152,"['科幻', '末世', '正剧', '废土']",2019-10-17,安折是朵蘑菇，毕生使命就是养出一颗自己的孢子。有一天，他把孢子弄丢了。他满世界找了很久，终于在新闻上看到了眼熟的孢子。安折绝望地敲开了人类军方某位上校的家门。“先生，您好。您手下那项研究进行得好吗？研究完可不可以把我的儿子还给我？”上校一脸冷漠：“你的儿子？”“我生的QAQ”上校：“我养的。”“真的，先生，我亲生的QAQ”“再生一个我看看。”安折：“嘤。”[食用指南]1.孢子不是生子。2.废土科幻，微克苏鲁。3.正常早6：00左右更新，有事会请假。11.7周四入v。*除了实体商志的独家番外，晋江上的连载版即为全部内容，无其它任何增添补充。
